about	ə ˈb ɐ ʊ t
about	ə ˈb o ʊ t
accend	æ k ˈs ɛ n d
Adam	ˈæ ɾ m̩
Adam	ˈæ ɾ ə m
added	ˈæ ɾ ə d
added	ˈæ ɾ ɪ d
added	ˈa d ə d
added	ˈa d ɪ d
addition	ə ˈd ɪ ʃ n̩
Adelaide	ˈæ d ɜ l æ ɪ̯ d
aerose	ˈi ˌɹ ə ʊ z
agglutinin	ə ˈɡ l uː ʔ n̩ ɪ n
album	ˈa ɫ b̚ m̩
alienation	ˌe ɪ l i ə ˈn e ɪ ʃ ə n
alignment	ə ˈɫ a ɪ n m ə n t
allergies	ˈæ l ə d͡ʒ i z
allergies	ˈæ l ɚ d͡ʒ i z
allergy	ˈæ l ə d ʒ i
allergy	ˈæ l ɚ d͡ʒ i
almanac	ˈɑ l m ə n æ k
alpha	ˈæ ɫ f ə
amatory	ˈɑː m ə t ə ɹ ɪ
amatory	ˈæ m ə ˌt ɔ ɚ̯ i
amphibious	æ m ˈf ɪ b i ə s
an	ˈɛ ə n
analects	ˈæ n ə ˌl ɛ k t s
Andrew	ˈeᵊ n ˌd̠ ɹ̠ ˔ʷ ʊ̈ u
Andrew	ˈæ n ˌd̠ ɹ̠ʷ ˔ ʊ̈ u
angsts	e ɪ ŋ k s t s
angsts	e ɪ ŋ k s t s
anthropomorphic	ˌæ̃ n̪ θ ɹ̠ ə p ə ˈm ɔ ɹ̠ f ɪ̈ k
aphorism	ˈæ f ə ɹ ɪ z m̩
argh	ɑ ɹ ɣ
argh	ɑ ɣː
Aristotle	ˈæ ɹ ɪ ˌs t ɑ ɾ ɫ̩
Aristotle	ˈɛ ɹ ɪ ˌs t ɑ ɾ ɫ̩
Arlon	ˈɑ ɹ ɫ ɔː n
Arlon	ˈɑː ɫ ɔː n
art	ɑ̈ ɹ t
art	ɐ ɹ t
Atlanta	æ t ˈl æ ɾ̃ ə
Atlanta	æ t ˈl æ n ə
attic	ˈæ ɾ ɪ k
aula	ˈɔː l a
aunt	ɑː n t
aunt	äː n t
aunt	ɐː n t
aunt	ɒː n t
aunt	ɑː n t
aunt	aː n t
aunt	äː n t
aunt	ɑː n t
aunt	æ n t
aunt	ɛ ə n t
aunt	e ə n t
aunt	a n t
aunt	æ n t
aunt	æ n t
aunt	ɛ ə n t
aunt	e ə n t
auto	ˈɑ ɾ o ʊ
autumn	ˈɑ ɾ ɪ̈ m
autumn	ˈɑ ɾ m̩
availability	ə ˌv e ɪ l ə ˈb ɪ l ɪ t ɪ
aw	ɔ̃ː
aw	ɒ̃ː
aw	ɔ ə
aw	o ə
aw	ʊ ə
aw	ɒ̃ː
ayuh	ˀe ɪ ˈʌˀ
baa	b æ̰ː
baa	b æ̰ˀ æ̰ˀ æ̰ˀ æ̰ˀ
backspin	ˈb æ k ˌs p ɪ n
bacterial	b æ k ˈt ɪ ə ɹ i ə ɫ
bail	ˈb e ɪ̯ ə ɫ
bail	b e ə̯ ɫ
balancelle	b æ l ə n ˈs e ɫ
baldric	ˈb ɔː ɫ d ɹ ɪ k
bale	ˈb e ɪ̯ ə ɫ
bale	b e ə̯ ɫ
Balt	b ɔː l t
Balt	b ɑ l t
bank	b e ɪ ŋ k
bank	b e ɪ ŋ k
barn	b ɑ ɹ n
barn	b ɑ ɻ n
barn	b a ɾ n
barn	b ɒ ə n
barn	b ɑː n
barn	b ɐː n
barn	b aː n
bashful	ˈb æ ʃ f ə ɫ
bashful	ˈb æ ʃ f ʊ ɫ
bath	b ɑː θ
bath	b ɑː t̪ʰ
bath	b ɑː t̪
bath	b æ θ ~ b ɛ ə θ ~ b e ə θ
bath	b a θ ~ b æ θ
bath	b æ θ ~ b ɛ ə θ ~ b e ə θ
Bautzen	ˈb a ʊ t s ə n
beagle	ˈb̥ iː ɡ ə ɫ
beared	b ɛː d
beared	b ɛ ɚ̯ d
beauty	ˈb j u ɾ i
bedight	b ɪ ˈd ʌ ɪ t
bedight	b ɪ ˈd ʌ ɪ t
beetle	ˈb i ɾ ə ɫ
befang	b ə ˈf æ ŋ
better	ˈb ɛ ɾ ɚ
betther	ˈb ɛ t̪ ɚ
betting	ˈb ɛ ɾ ɪ ŋ
bike	b ɐ ɪ k
bill	b ɪ ɫ
Bill	b ɪ ɫ
bitey	ˈb a ɪ̯ ɾ i
bitty	b ɪ ɾ i
bleach	b l i t͡ʃ
bleach	b l iː t͡ʃ
bleacher	ˈb ɫ i t͡ʃ ɚ
bleacher	ˈb l iː t͡ʃ ə
blem	b l ɛ m
blem	b l ɛ m
blicky	ˈb l ɪ k i
bockety	ˈb ɑ k ə t iː
bottle	ˈb̥ ɑ ɾ ɫ̩
bottle	ˈb ɑ ɾ ɫ̩
bountiful	ˈb a ʊ̯ n ɾ ə f ə ɫ
boutye	ˈb ɐ ʏ t͡ʃ ə
brakeforce	b ɹ e ɪ k f ɔː ɹ s
breach	b ɹ iː t ʃ
break	b ɹʷ e ɪ̯ k
Breault	b ɹ o ʊ̯
brew	b ɹ ʉ w
Brighton	ˈb ɹ a ɪ̯ ʔ ə n
British	ˈb ɹ ɪ ɾ ɪ ʃ
buccopalatal	ˌb ʌ kʰ o ʊː ˈpʰ æː l ə ɾ ɫ̩
bumboclaat	b ʌ m b ə k l ɑ t
butted	ˈb ʌ ɾ ɨ d
butter	ˈb ɐ tʰ ə
butter	ˈb ʌ ɾ ɚ
butter	ˈb a ɾ a
butter	ˈb ʌ ʔ ɚ
butterfly	ˈb ʌ ɾ ɚ f l a ɪ
butterfly	ˈb ʌ t ə f l a ɪ
butterfly	ˈb ʌ ɾ ɚ f l a ɪ
butting	ˈb ʌ ɾ ɪ ŋ
buttings	ˈb ʌ ɾ ɪ ŋ z
cacoepy	k ə ˈk ə ʊ ɪ p ɪ
Cain	kʰ e ɪ n
cake	kʰ e ɪ k
calculable	ˈkʰ æ ɫ k j ə ˌl ə b l̩
cam	k æ m
Cambodia	k æ m ˈb o ʊ d i ə
came	kʰ e ɪ̯ m
camp	kʰ ɛ ə m p
camp	kʰ e ə m p
camp	kʰ ɛ ə m p
camp	kʰ e ə m p
can	ˈkʰ æ n
can	ˈkʰ ɛ ə n
can	ˈkʰ e ə n
can	kʰ ə n
can	kʰ n̩
Canada	kʰ ɛ ə n ə ɾ ə
Canada	kʰ e ə n ə d ə
Canadian	kʰ ə ˈn e ɪ ɾ i ə n
can't	k æ n ʔ
can't	kʰ ẽ ə̃ n t
can't	kʰ ɪ̃ ə̃ n t
cap	kʰ æ p
caramba	k a ˈɹ a m b a
cathedra	k ə ˈθ iː d ɹ ə
caught	kʰ ɔː t
caught	k̠ʰ oː t
caught	kʰ ɔ t
caught	kʰ ɔ ə̯ t
caught	kʰ o ə̯ t
caught	kʰ ʊ ə̯ t
caught	kʰ ɑ t
caught	kʰ ɒ t
cauterize	ˈkʰ ɔ ɾ ə ɹ a ɪ z
cauterize	ˈkʰ ɑ ɾ ə ɹ a ɪ z
ceili	k e ɪ l i
ceramah	t͡ʃ ə ˈr a m ʌ
chai	χ a i̯
chance	t͡ʃʰ ɛ ə n s
chance	t͡ʃʰ e ə n s
chance	t͡ʃʰ æ n s
chance	t͡ʃʰ a n s
chance	t͡ʃʰ eː n s
chance	t͡ʃʰ ɛ ə n s
chance	t͡ʃʰ e ə n s
chance	t͡ʃʰ ɑː n s
chance	t͡ʃʰ ɐː n s
chance	t͡ʃ ɑː n s
Chance	t͡ʃʰ ɛ ə n s ~ t͡ʃʰ e ə n s
Chance	t͡ʃʰ æ n s ~ t͡ʃʰ a n s
Chance	t͡ʃʰ ɛ ə n s ~ t͡ʃʰ e ə n s
Chance	t͡ʃʰ ɑː n s
Chance	t͡ʃʰ ɐː n s
chatted	ˈt͡ʃ æ ɾ ɨ d
chattel	ˈt͡ʃ æ ɾ ɫ̩
cheated	ˈt͡ʃ i ɾ ɨ d
check	t͡ʃ ɛ k̚
chlordiazepoxide	ˈk l ɔː r ˌd a ɪ ə z e p ˈo k s a ɪ d
choo	t ʃ uː
circle	ˈs ɜː k ə ɫ
circle	ˈs ɝ k ə ɫ
city	ˈs ɪ tʰ iː
city	ˈs ɪ ɾ i
clamming	ˈk l a m ɘ n
clay	k l̥ e ɪ
cleanup	ˈkʰ l iː ˌn ʌ p
click	kʰ l̥ ɪ k
cliff	k l̥ʰ ɪ f
Clinton	ˈk l ɪ n ʔ n̩
clip	k l̥ʰ ɪ p
coccus	ˈkʰ ɑ k ə s
collaboration	kʰ ə ˌl æ b ə ˈɹ e ɪ̯ ʃ ə n
comfortable	ˈkʰ ʌ ɱ f tʰ ə̥ b ɫ̩
comfortable	ˈkʰ ɐ ɱ f t ɘ b ɫ̩
comfy	ˈkʰ ʌ ɱ f i
comfy	kʰ ʌ m p f i
committee	k ə ˈm ɪ t i
community	k ə ˈm j u n ə ɾ i
Comox	ˈkʰ o ʊ ˌm ɒ k s
comptroller	k ə m p ˈt ɹ o ʊ l ə ɹ
comptroller	k ə m ˈt ɹ o ʊ l ə ɹ
concoct	kʰ ə ŋ ˈkʰ ɒ k t
consigliere	ˌk ɒ n s ɪ l ˈj ɛ ɹ i
coolly	ˈk uʷ ɫ l i
coolly	ˈk ʉː l i
cores	kʰ o̞ ɹ z
cottage	ˈk ɑ ɾ ɪ d͡ʒ
coulda	ˈkʰ ʊ d ə
couldn't	ˈk ʊ n ʔ
countable	ˈkʰ a ʊ n ɾ ə b ɫ̩
country	ˈkʰ ʌ n t̠ ɹ̠̊ ˔ʷ i
craytur	ˈk ɹ eː t̪ ə ɹ
creation	k ɹ iː ˈe ɪ ʃ ɘ n
creep	kʰ ɹ iː p
crisscross	ˈk ɹ ɪ s ˌk ɹ ɔ s
crisscross	ˈk ɹ ɪ s ˌk ɹ ɒ s
croissant	kʰ ɹ̥ ə ˈs ɑ n t
cryptography	k ɹ̥ ɪ p ˈtʰ ɒ ɡ ɹ ə f iː
Cuban	ˈk j ʉː b ə n
Cuban	ˈk j uː b ə n
Cuban	ˈk j u b ə n
culprit	ˈkʰ ʌ ɫ p ɹ̥ ɪ t
cunt	kʰ ʌ̃ n t
cymbal	ˈs ɪ m b ɫ̩
dance	d ɛ ə n s
dance	d e ə n s
dance	d æ n s
dance	d a n s
dance	d ä n s
dance	d æː n s
dance	d ɑː n s
dance	d äː n s
dance	d ɐː n s
dance	ɖ ɑː n s
Daniel	ˈd a n j ə l
darty	ˈd ɑ ɹ ɾ i
data	ˈd æ ɾ ə
daydream	ˈd e ɪ d͡ʒ ɹ iː m
dayouth	d a ˈjː uː θ
dayouth	d æ ˈjː uː θ
dayum	ˈd æ̙ j ə m
dayum	ˈd e ə j ə m
dean	d iː n
dean	d ĩː n
Delphi	ˈd ɛ ɫ f i
delta	ˈd ɛ ɫ t ə
Denton	d ɪ n ʔ n̩
desirable	d ɪ ˈz a ɪ j ə ɹ ə b ə ɫ
didn't	ˈd ɪ n ʔ
differential	d ɪ f ə ˈɹ ə n ʃ ə ɫ
diggety	ˈd ɪ ɡ ə ɾ i
dight	d ʌ ɪ t
dingaling	ˈd ɪ ŋ ə l ɪ ŋ
didn't	ˈd ɪ n ʔ
differential	d ɪ f ə ˈɹ ə n ʃ ə ɫ
diggety	ˈd ɪ ɡ ə ɾ i
dight	d ʌ ɪ t
dingaling	ˈd ɪ ŋ ə l ɪ ŋ
disentangle	ˌd ɪ s ɪ n ˈt æ ŋ ɡ ə ɫ
disentitle	ˌd ɪ s ɪ n ˈt a ɪ t ə ɫ
dispel	d ɪ ˈs p ɛ ɫ
dispensable	d ɪ s ˈpʰ ɛ n s ə b ɫ̩
dissemble	d ɪ ˈs ɛ m b ə ɫ
Dniester	ˈn iː s t ə
Dniester	d n ɪ ˈe s t ə
Dollywood	ˈd ɑ ɫ i w ʊ d
Dollywood	ˈd ɒ ɫ i w ʊ d
doughty	ˈd ʌ ʊ̯ ɾ i
drag	d͡ɹ̝ ˗ʷ æˑ ɡ
dragon	ˈd ɹ e ɪ ɡ ə n
drain	d͡ʒ ɹ e ɪ n
dream	d͡ʒ ɹ iː m
dream	d̠͡ɹ̠ ˔ʷ ɪ i̯ m
dreaming	ˈd͡ʒ ɹ iː m ɪ ŋ
dreams	d͡ʒ ɹ iː m z
dreich	d ɹ iː x
dried	d͡ʒ ɹ a ɪ d
drill	d ɹ ɪ ɫ
drive	d ʒ ɹ a ɪ v
drought	d ɹ ʌ ʊ t
droughty	ˈd ɹ ʌ ʊ ɾ i
drown	d̠͡ɹ̠ ˔ʷ a ʊ n
dry	d͡ʒ ɹ a ɪ̯
dry	d̠͡ɹ̠ ˔ a ɪ̯
dry	d̠͡ɹ̠ ˔ʷ a ɪ̯
drying	ˈd͡ʒ ɹ a ɪ ɪ ŋ
eaten	ˈiː ʔ n̩
edition	ɪ ˈd ɪ ʃ n̩
el	ɛ ɫ
'em	ə m
'em	m̩
'em	ɪ m
'em	ɛ m
emphasis	ˈɛ ɱ f ə s ɪ s
emphasis	ˈe ɱ f ə s ɪ s
emphasis	ˈɛ ɱ f ə s ə s
emphasis	ˈe ɱ f ə s ə s
encephalon	ɛ n ˈs ɛ f ə l n̩
encephalon	ɛ n ˈs ɛ f ə l ɔ n
encouragement	ɪ n ˈk ʌ ɹ ɪ d͡ʒ m ə n t
encephalon	ɛ n ˈs ɛ f ə l n̩
encephalon	ɛ n ˈs ɛ f ə l ɔ n
encouragement	ɪ n ˈk ʌ ɹ ɪ d͡ʒ m ə n t
ensnarl	ɛ n ˈs n ɑː ɫ
ensnarl	ɛ n ˈs n ɑ ɚ̯ ɫ
epigraphy	ʔ ɨ ˈpʰ ɪː ɡ ɹ ə f iː
epimutation	ɛ p ɪ m j u ˈt e ɪ ʃ ə n
epitomic	e p iː ˈt ɔ m ɪ k
epitomic	ˌɛ p ɪ ˈt ɒ m ɪ k
epitomic	ˌɛ p ɪ ˈt ɑ m ɪ k
essential	ə ˈs ɛ n t ʃ ə l
eugh	ə x
eugh	ʌ x
eugh	ɜː
ew	ɪ̃ː ʉ̃͡u
ew	ɯ᷈ː
ew	ʏ ʊ̯ː
exam	ɪ ɡ ˈz æ m
exchange	ɛ k s ˈt͡ʃʰ e ɪ n d͡ʒ
exchange	ɛ k ˈs t͡ʃ e ɪ n d͡ʒ
exosome	ˈɛ k s ə ʊ̯ ˌs ə ʊ̯ m
exosome	ˈɛ k s o ʊ̯ ˌs o ʊ̯ m
fanaticism	f ə ˈn æ ɾ ɪ s ɪ z m̩
farrand	ˈf æ ɹ ə n d
farrand	ˈf æ ɹ ə n t
fatal	ˈf e ɪ ɾ ɫ̩
fatally	ˈf e ɪ̯ ɾ l̩ i
fated	ˈf e ɪ̯ ɾ ɨ d
fauxtograph	ˈf oː t ə ɡ ɹ ɑː f
federale	f ɛ d ə ˈɹ ɑː l i
feel	f iː ɫ
fence	f ɛ n s
fence	f ɛ n t s
fencer	ˈf ɛ n s ɚ
feudalism	ˈf j u d ə l ɪ z m̩
fiddy	ˈf ɪ ɾ i
fight	f ʌ ɪ t
fill	f ɪ ɫ
filling	ˈf ɪ ɫ ɪ ŋ
film	f ɪ ɫ m
firstborn	ˈf ɜː s t ˌb ɔː n
firstborn	ˈf ɝ s t ˌb ɔ ɚ̯ n
fitra	ˈf ɪ tˤ ɾ a
fitra	ˈf ɪ t ɾ a
Fitz	f ɪ t s
flaithiúlach	f l æ ˈh uː l ə x
flizz	f l ɪ z
flouted	ˈf l a ʊ̯ ɾ ɨ d
flouting	ˈf l a ʊ̯ ɾ ɪ ŋ
fondling	ˈf ɒ n d ɫ̩ ɪ ŋ
foot	f ʊ t
foot	f ʊ t̚
foot	f ʊ t̚
foot	f ʊ tʰ
foot	f ɵ ʔ t
foot	f ʊ t̚
foot	fʷ ʊ t̚
foot	f ɤ t
foot	f ʉ̞ ʔ t
foot	f ʊ t̚
foot	fʷ ʊ t̚
football	fʷ ʊ ʔ t̚ b ɑ ɫ
foretell	f oː ˈt e ɫ
foretell	f ɔː ˈt ɛ ɫ
foretell	f ɔ ɹ ˈt ɛ ɫ
free	f ɹ ɪ i̯
fsck	f͡s̪ k
fsck	ɸ͡s k
fsck	ɸ͡s̪ k
fuel	ˈf j u w ə ɫ
full	f ʊ ɫ
furcal	ˈf ɜː k ə ɫ
furcal	ˈf ɝ k ə ɫ
Gaeltacht	ˈɡ e ɪ l t ə x t
Gangtok	ˈɡ æ ŋ t ɒ k
gaumy	ˈɡ ɔː m i
geaux	ɡ o ʊ
gel	d͡ʒ ɛ ɫ
genetic	d͡ʒ ə ˈn ɛ t ɪ k
genetic	d͡ʒ ɪ ˈn ɛ t ɪ k
genkan	ˈɡ ɛ ŋ k ɑ n
glass	ɡ l ɑː s
glass	ɡ l äː s
glass	ɡ l ɐː s
glass	ɡ l æ s
glass	ɡ l ɛ ə s
glass	ɡ l e ə s
glass	ɡ l a s
glass	ɡ l æ s
glass	ɡ l æ s
glass	ɡ l ɛ ə s
glass	ɡ l e ə s
glizzy	ˈɡ l ɪ z i
Gmail	ˈd͡ʒ iː ˌm e ɪ l
go	ɡ ə ʊ
go	ɡ o ʊ
go	ɡ ə ʉ
go	ɡ ɐ ʉ
go	ɡ u
gonna	ˈɡ o ʊ ɪ n ə
gout	ɡ ʌ u t
gowk	ˈɡ æ ʊ̯ˀ k
gramophone	ˈɡ ɹ æ m ə ˌf o ʊ n
gramophone	ˈɡ ɹ æ m ə ˌf ə ʊ n
grass	ɡ ɹ̠ ɑː s
grass	ɡ ɹ̠ äː s
grass	ɡ ɹ̠ ɐː s
grass	ɡ ɹ̠ æ s
grass	ɡ ɹ̠ ɛ ə s
grass	ɡ ɹ̠ e ə s
grass	ɡ ɹ̠ a s
grass	ɡ ɹ̠ æ s
grass	ɡ ɹ̠ æ s
grass	ɡ ɹ̠ ɛ ə s
grass	ɡ ɹ̠ e ə s
grated	ˈɡ ɹ e ɪ̯ ɾ ɪ d
gratified	ˈɡ ɹ æː ɾ ɨ f a ɪː d̚
grating	ˈɡ ɹ e ɪ̯ ɾ ɪ ŋ
grivna	ˈɡ ɹ ɪ v n ɑ
grr	ɡ ɚːː
guileless	ˈɡ a ɪ ɫ l ə s
guttural	ˈɡ ʌ ɾ ɚ ɫ̩
gyros	ˈd͡ʒ a ɪ ɹ o ʊ z
h	æ ɪ t͡ʃ
ha	h aː
háček	ˈh ɑː t͡ʃ ɛ k
háček	ˈh ɑ t͡ʃ ɛ k
háček	ˈh ɑ ə t͡ʃ ɛ k
háček	ˈh aː t͡ʃ ɛ k
háček	ˈh aː t͡ʃ e k
háček	ˈh ɐː t͡ʃ e k
háček	ˈɦ ɑː t͡ʃ ɛ k
hadith	h a ˈd iː θ
hah	h aː
hail	h e ɪ̯ ɫ
hair	h ɛ ɚ
hang	h e ɪ ŋ
hang	h e ɪ ŋ
hangnail	h e ɪ ŋ n e ɪ̯ ɫ
hangnail	h e ɪ ŋ n e ɪ̯ ɫ
hapa	ˈh a p ɐ
hapa	ˈh a p ə
hapa	ˈh a p ɐ
happening	h æ p n ɪ n
hat	h a t
health	h ɛ l̪ θ
high	h a ɪ̯
hill	h ɪ ɫ
hinoki	h i ˈn o k i
hmmm	m̥ m̩ː ˦˨
holding	ˈh ə ʉ ɫ d ɪ ŋ
holding	ˈh ə ʊ ɫ d ɪ ŋ
holding	ˈh o ʊ ɫ d ɪ ŋ
Hollywood	ˈh ɑ ɫ i w ʊ d
Hollywood	ˈh ɒ ɫ i w ʊ d
homophobe	ˈh ɒ m ə ˌf ə ʊ b
homophobe	ˈh ə ʊ m ə ˌf ə ʊ b
hon	m̥ ɑ n
hood	h ʊ̈ d
hood	h ɪ̈ d
humanist	ˈh ç uː m ə n ɪ s t
humanist	ˈç uː m ə n ɪ s t
humanist	ˈh ç uː m ə n ɪ s t
humanist	ˈç uː m ə n ɪ s t
humongous	ç u̟ː ˈm ʊ ŋ ɡ ə s
humongous	ˌç u̟ː ˈm ɐ ŋ ɡ ə s
Humvee	ˈh ʌ m β iː
Humvee	ˈh ʌ ɱ v iː
hyperhidrosis	h a ɪ p ə ɹ h a ɪ ˈd ɹ o ʊ s ɪ s
I	a ɪ̯
I	aː
I	ɑ e̯
ice	ʌ ɪ s
incalculable	ɪ n ˈkʰ æ ɫ k j ə ˌl ə b l̩
incidental	ɪ n s ɪ ˈd ɛ ɾ̃ ə l
incidental	ɪ n s ɪ ˈd ɛ n tʰ ə l
inexorably	ɪ n ˈɛ ɡ z ə ɹ ə b l i
inference	ˈɪ ɱ f ə ɹ ə n s
inference	ˈɪ ɱ f ɹ ə n s
inhalation	ˌɪ n ɦ ə ˈl e ɪ ʃ n̩
input	ˈɪ n p ʊ t
input	ˈɪ m p ʊ t
insolvency	ɪ n ˈs ɒ l v n̩ s i
installation	ɪ n s t ə ˈl e ɪ ʃ ə n
intelligibility	ɪ n ˌt ɛ l ə d͡ʒ ə ˈb ɪ l ɪ ɾ i
intelligibility	ɪ n ˌt ɛ l ə d͡ʒ ə ˈb ɪ l ə ɾ i
intentional	ɪ n ˈtʰ ɛ n ʃ n̩ ɫ̩
interconnect	ˌɪ ɾ̃ ɚ k ə ˈn ɛ k t
interconnect	ˌɪ n ɾ ɚ k ə ˈn ɛ k t
investigate	ɪ n ˈv ɛ s t ɪ ɡ e ɪ̯ t
invincibility	ɪ n ˌv ɪ n s ə ˈb ɪ l ə ɾ i
IPA	ˌa ɪ pʰ iː ˈe ɪ
Ireland	ˈɑ ɪ ɚ l ə n d
Ireland	ˈʌ ɪ ɚ l ə n d
Ireland	ˈə ɪ ɚ l ə n d
Ireland	ˈɑ ɚ l ə n d
Ireland	ˈa ɪ ɚ l ə n d
Ireland	ˈä ɪ ɚ ɫ ɪ̈ n d
Ireland	ˈɑ ɪ ə l ə n d
item	ˈa ɪ̯ ɾ ə m
item	ˈa ɪ̯ ɾ m̩
joged	ˈd͡ʒ o ɡ ə d
joget	ˈd͡ʒ o ˈɡ ɛ t
K	kʰ e ɪ
kamp	kʰ ɛ ə m p
kamp	kʰ e ə m p
kamp	kʰ ɛ ə m p
kamp	kʰ e ə m p
kana	ˈkʰ ɑː n ə
karma	ˈk ɑː m ə
karma	ˈk ɑ ɹ m ə
karma	ˈk ə ɾ m ə
Katy	ˈkʰ e ɪ̯ ɾ i
Kebnekaise	ˈk ɛ b n ə ˌk a i s ə
keep	kʰ i p̚
keloid	ˈk iː l ɔ ɪ d
kept	kʰ ɛ p t̚
kettle	ˈkʰ ɛ tᵊ ɫ̩
Khmer	kʰ ə ˈm ɛ ɹ
kiasu	ˌk i ɑ̃ː ˨ ˈs uː
kick	kʰ ɪ k
kiddie	ˈkʰ ɪ ɾ i
kiddie	ˈkʰ ɘ ɾ iː
kiddie	ˈkʰ ɪ ɾ i
kiddy	ˈkʰ ɪ ɾ i
kindergarten	ˈkʰ ɪ n d ə ɹ ˌɡ ɑː ɹ t̬ ə n
kindergarten	ˈkʰ ɪ ɾ̃ ə ɹ ˌɡ ɑː ɹ ʔ n̩
kiss	kʰ ɪ s
kitty	ˈkʰ ɪ ɾ i
kitty	ˈkʰ ɘ ɾ iː
kitty	ˈkʰ ɪ ɾ i
knout	n ʌ ʊ t
Koizumi	kʰ ɔ i̯ ˈz u m i
kratom	ˈk ɹ e ɪ̯ t ə m
kumara	ˈkʰ ʉː m ə ɹʷ ɐ
kumara	ˈkʰ ʉː m ɐ ɾ ɐ
l	l
l	ɫ
l	w
language	ˈl e ɪ ŋ ɡ w ɪ d͡ʒ
language	ˈl e ɪ ŋ ɡ w ɪ d͡ʒ
languages	ˈl e ɪ ŋ ɡ w ɪ d͡ʒ ɪ z
lastborn	ˈl ɑː s t ˌb ɔː n
lastborn	ˈl æ s t ˌb ɔ ɚ̯ n
laundry	ˈl ɑ n d ɹ i
leeway	ˈl iː ˌw e ɪ
liable	ˈl a ɪ̯ ə b ɫ̩
liable	ˈl a ɪ̯ ə b ə ɫ
licensed	ˈl a ɪ s n̩ s t
li'l	l ɪ ɫ
li'l	l ɪ ɫ̩
listen	ˈl ɪ s n̩
literary	ˈɫ ɪ ɾ ə ɹ ɛ ə ɹ i
'll	ə l
'll	l̩
'll	ɫ̩
'll	ʊ
'll	ɯ
loofball	ˈl ʊ ʔ f̚ b ɔː l
love	l ʌ v
love	ɫ ʌ v
love	ɫ ä v ~ ɫ ɐ v
love	l ɘ ʋ
love	l ɘ v
Luddite	ˈl ʌ ɾ ʌ i t
lulls	l ɐ ɫ z
lulls	ɫ ʌ ɫ z
lunch	l ʌ̃ n t͡ʃ
Lycra	ˈl a ɪ k ɹ ə
mailed	m e ɪ ɫ d
maintenance	ˈm ẽ ɪ̃ n ʔ ə n ə n s
make	m e ɪ kʲ
Malinois	ˈm æ l ɪ n ˌw ɑː
mamaliga	m ə m ə ˈl i ɡ ə
man	m ɛ ə n
man	m e ə n
man	m ẽ ə̃ n
mawky	m ɔː k i
medal	ˈm ɛ d ɫ̩
medal	ˈm ɛ ɾ ɫ̩
medal	ˈm e ɾ ɫ̩
meddle	ˈm ɛ ɾ ə ɫ
medulla	m ə ˈd ɐ l ə
medulla	m ɛ ˈd ɐ l ə
mental	ˈm ɛ ɾ̃ ɘ l
mental	ˈm ɛ n ɘ l
mental	ˈm ɛ ɾ̃ ɘ l
mental	ˈm ɛ n ɘ l
merveilleuse	m ɛ ʁ v ɛ j ø z
merveilleux	m ɛ ʁ v ɛ j ø
Metairie	ˈm ɛ ɾ ə ɹ i
metal	ˈm ɛ ɾ ə ɫ
methoxphenidine	ˌm ɛː θ ɑ k s ˈf ɛː n ɨ ɾ ĩː n
mhm	m̩ ˈm̥ m̩ ˥
Michael	ˈm ɐ ɪ k ɫ̩
Michigander	ˈm ɪ ʃ ə ˌɡ æ n d ɚ
middleman	ˈm ɪ d ɫ̩ ˌm æ n
midst	m ɪ d s t
midst	m ɪ t s t
Mike	m ɐ ɪ ʔ k̚
Mikey	ˈm ɐ ɪ kʰ iː
milk	m ɛ l k
milkshake	ˈm ɪ ɫ k ʃ e ɪ k
mill	m ɪ ɫ
million	ˈm ɪ ʎ ə n
mmm	m̩ː
Moncion	ˈm o ʊː s i ˌõː n
mount	m a ʊ n t
mount	m a ʊ n ʔ
mount	m ã ʊ̃ n ʔ
Mr.	ˈm ɪ s t ɚ
multiplayer	ˌm ɐ ɫ t i ˈp l e ɪ̯ ə
multiplayer	ˌm ʌ ɫ t i ˈp l e ɪ̯ ɚ
multiplier	ˈm ʌ ɫ t ɪ ˌp l a ɪ ə ɹ
multiplier	ˈm ʌ ɫ t ɪ ˌp l a ɪ ɚ
murr	m ɜː ɹ
murr	m ɝ
mustard	ˈm a s t ə d
mustard	ˈm ɐ s t ə d
mustard	ˈm ʊ s t ə d
mustard	ˈm ʌ s t ɚ d
mutable	ˈm j uː t ə b l̩
myrrh	m ɜː ɹ
myrrh	m ɝ
'n'	ə n
'n'	n̩
nah	n æː
nah	n ɑː
nah	n ẽː
nail	n e ɪ̯ ɫ
Nauruan	n ɑː ˈuː ɹ uː n̩
nextborn	ˈn ɛ k s t ˌb ɔː n
nextborn	ˈn ɛ k s t ˌb ɔ ɚ̯ n
Ng	ŋ̍
nighttime	ˈn a ɪ ʔ t a ɪ m
nizz	n ɪ z
nonalphanumeric	n ɒ n ˌæ l f ə n j uː ˈm ɛ ɹ ɪ k
nonalphanumeric	n ɑ n ˌæ l f ə n u ˈm ɛ ɚ̯ ɪ k
nonna	ˈn ɔ nː ɐ
nonna	ˈn ɔ nː ə
nope	n o ʊ p̚
not	n ɒ t
not	n ɒ ʔ t
not	n ɑ ʔ t
nothing	ˈn ʌ ʔ n̩
numeration	ˌn u m ɚ ˈe ɪ ʃ ə n
numeration	ˌn j uː m ə ˈɹ e ɪ ʃ ə n
nymphid	ˈn ɪ m f ɪ d
octagram	ˈɒ k t ə ɡ ɹ æ m
octagram	ˈɑ k t ə ɡ ɹ æ m
oil	ɔ ɪ ɫ
oni	ˈo ʊ n iː
oop	ɤ p
our	ɑ ɹ
our	ɑ ˞
outta	ˈa ʊ t ə
outta	ˈa ʊ ʔ ə
outta	ˈa ʊ ɾ ə
outta	aː ɾ ə
outta	ˈæː ɾ ə
outta	ˈʌ ʊ ɾ ə
outta	ˈʌ ʊ ɾ ə
pack	pʰ æ k
package	ˈpʰ a k ɛ d͡ʒ
paddle	ˈpʰ æ ɾ ɫ̩
Paddy	ˈpʰ æ ɾ i
pah	pʼ a
pah	pʼ aʰ
pail	pʰ e ɪ̯ ɫ
pail	pʰ e ə ɫ
pail	pʰ e ɪ̯ ɫ
pail	pʰ e ə ɫ
PAL	pʰ æ l
parcel	ˈpʰ aː s ə ɫ
parcel	ˈpʰ ɑː s ə ɫ
parcel	ˈpʰ ɑ ɹ s ə ɫ
pardon	ˈpʰ ɑ ˞ d n̩
park	pʰ aː k
park	pʰ ɒ ə k
park	pʰ ɐː k
park	p ɑ ɹ k
park	pʰ ɑː k
park	pʰ ɑ ɹ k
parole	p ə ˈɹ ə ʊ ɫ
parole	p ə ˈɹ o ʊ ɫ
partner	ˈp ɑ ɹ ʔ n ɚ
party	ˈpʰ ɑ ɹ ɾ i
pass	pʰ ɑː s
pass	pʰ äː s
pass	pʰ ɐː s
pass	pʰ aː s
pass	pʰ æ s
pass	pʰ ɛ ə s
pass	pʰ e ə s
pass	pʰ a s
pass	pʰ æ s
pass	pʰ ä s
pass	pʰ e ə̯ s
pass	pʰ æ s
pass	pʰ ɛ ə s
pass	pʰ e ə s
pat	pʰ æ t
pat	pʰ æ t̚
pat	pʰ æˀ t̚
path	pʰ ɑː θ
path	pʰ äː θ
path	pʰ ɐː θ
path	pʰ æ θ
path	pʰ ɛ ə θ
path	pʰ e ə θ
path	pʰ a θ
path	pʰ æ θ
path	pʰ æ θ
path	pʰ ɛ ə θ
path	pʰ e ə θ
Patrick	ˈpʰ æ t̠ ɹ̠̊ ˔ʷ ɪ k̚
patting	ˈpʰ æ ɾ ɪ ŋ
pattings	ˈpʰ æ ɾ ɪ ŋ z
pay	pʰ e ɪ
peculiar	pʰ ə ˈkʰ j uː l j ʊ ə
peculiar	pʰ ə ˈkʰ j u l j ʊ ɹ̠
peculiar	pʰ ə ˈkʰ j u l j ɚ
peel	pʰ iː ɫ
peel	pʰ i ə ɫ
peel	pʰ iː ɫ
peel	pʰ i ə ɫ
peg	pʰ ɛ ɡ
performance	p ə ˈf ɔː m ə n s
performance	p ɚ ˈf ɔ ɹ m ə n s
perineum	p ə ˈɹ ɪ n iː ə m
pet	pʰ ɛ t
pet	pʰ ɛ ʔ t
petting	ˈpʰ ɛ ɾ ɪ ŋ
pff	p͡ɸː
pff	ʙ̥͡ɸː
pfft	p͡ɸː t
phew	ɸ j u̥ ˥˩
Philadelphia	f ɪ ɫ ə ˈd ɜ ɫ f i ə
phlebolith	ˈf l ɛ b ə l ɪ θ
pick	pʰ ɪ k
pigpen	ˈpʰ ɪ ɡ ˌpʰ ɛ n
piling	ˈpʰ a ɪ̯ ɫ l ɪ ŋ
pill	pʰ ɪ ɫ
pin	pʰ ɪ n
pittance	ˈpʰ ɪ ʔ n̩ s
pizza	ˈpʰ i t s ə
place	p l̥ e ɪ s
plack	pʰ l̥ æ k
plague	pʰ l̥ e ɪ ɡ
plain	p l̥ e ɪ n
plan	pʰ l̥ æ n
plant	pʰ l̥ æ n t
plate	pʰ l̥ e ɪ t
play	p l̥ e ɪ
poilu	ˈp w ɑː l uː
pole	pʰ o ʊ ɫ
pole	pʰ o ə ɫ
poof	p uː ɸ
pool	pʰ u ɫ
pool	pʰ u ə ɫ
poomplex	ˈp ʊ m p l ɛ k͡s
pow	p ə ʉ
pree	p ɹ iː
pressure	ˈp ɹ ɛ ʃ ə ɹ
pressure	ˈp ɹ ɛ ʃ ɚ
pretzel	ˈpʰ ɹ ɛ ʔ t͡s ɫ̩
prick	pʰ ɹ̠̊ ɪ k
pride	ˈp ɹ̥ʷ a ɪ d
priest	ˈp ɹ̥ iː s t
prim	pʰ ɹ̠̊ ɪ m
principles	ˈp ɹ ɪ n s ə p l̩ z
prism	ˈpʰ ɹ̠̊ ɪ z m̩
prison	pʰ ɹ̠̊ ɪ z n̩
pronunciation	pʰ ɹ ə ˌn ʌ n s i ˈe ɪ ʃ ə n
propaganda	ˌp ɹ ɒ p ə ˈɡ æ n d ə
propaganda	ˌp ɹ ɑ p ə ˈɡ æ n d ə
ptui	p͡tʼʰ
ptui	p͡tʼʰ ə̥
Pulliam	ˈpʰ ʊ ɫ j ə̃ m
Pulliam	ˈpʰ ʊ ɫ i m̩
push	pʷ ʊ ʃ
put	pʰ ʊ ʔ t
Putler	ˈp u t l ɚ
putt	pʰ ʌ t
putting	ˈpʰ ʊ t ɪ ŋ
putting	ˈpʰ ʊ ɾ ɪ ŋ
putting	ˈpʰ ʌ t ɪ ŋ
Pyrrha	ˈpʰ ɪ ɹ̠ ə
quantum	ˈkʰ w ɑ n tʰ ə m
quantum	ˈk w ɑ ɾ̃ ə m
queen	kʷ w̥ iː n
quick	kʰ w̥ ɪ k
quid	kʰ w̥ ɪ d
quill	kʰ w̥ ɪ l
quilt	kʰ w̥ ɪ l t
quin	kʰ w̥ ɪ n
Quinn	kʰ w̥ ɪ n
quint	kʰ w̥ ɪ n t
quip	kʰ w̥ ɪ p
quit	kʰ w̥ ɪ t
quiz	kʰ w̥ ɪ z
rail	ɹ e ɪ ɫ
rajgira	ˈɾ ɑː d͡ʒ ɡ i r ɑː
'rales	ɹ ɑː l i z
rambo	ɹ æ m b ə ʊ
rattle	ˈɹ æ t ɫ̩
readable	ˈɹ iː d ə b l̩
reading	ˈɹ iː ɾ ɪ ŋ
reading	ˈɹ i ɾ i ŋ
reasoned	ˈɹ iː z n̩ d
red	ɻʷ ɛˑ d̥
reëvoke	ɹ iː ʔ i ˈv ə ʊ k
relative	ˈɹ ɛ l ə ɾ ɪ v
relative	ˈɹ ɛ l ə tʰ ɪ v
relative	ˈɹ ɛ l ə ɾ ɪ v
relative	ˈɹ ɛ l ə tʰ ɪ v
relatively	ˈɹ ɛ l ə tʰ ɪ v l i
relatively	ˈɹ ɛ l ə ɾ ɪ v l i
relatively	ˈɹ ɛ l ə tʰ ɪ v l i
relatively	ˈɹ ɛ l ə ɾ ɪ v l i
revelry	ˈɹ ɛ v ə ɫ ɹ i
rhythm	ˈɹ ɪ ð m̩
rider	ˈɹ̠ ä ɪ ɾ ɚ
rocks	ɹʷ ɒ k s
rocks	ɹʷ ɑ k s
rout	ɹ ʌ ʊ t
rout	ɹ ʌ ʊ t
routes	ɹ ʌ ʊ t s
routs	ɹ ʌ ʊ t s
rubbed	ˈɹ ʌˑ b̚ d̥
rule	ɹ̠ʷ uː ɫ
sail	s e ɪ̯ ɫ
sang	s æ ŋ
sang	s e ɪ ŋ
sang	s a ŋ
sang	s æ ŋ
sang	s ɛ ŋ
scalable	ˈs k e ɪ̯ ɫ ə b l̩
scale	s k e ɪ̯ ə ɫ
scallion	ˈs k æ l ɪ ə n
scallion	ˈs k æ l j n̩
scape	ˈs k e ɪ p
schemes	s k iː m z̥
scout	s k ʌ ʊ t
screech	s k ɹ iː t͡ʃ
screech	s k ɹ i t͡ʃ
screen	s k ɹ̥ʷ ɪ i̯ n
selfish	ˈs ɛ ɫ f ɪ ʃ
sentence	ˈs ɛ n t n̩ t͡s
sentence	ˈs ɛ n ʔ n̩ t͡s
shawty	ˈʃ ɔː ɾ i
shouldn't	ˈʃ ʊ n ʔ
shuyookh	ʃ ʊ ˈj uː x
shuyookh	ʃ u ˈj uː x
sibyl	ˈs ɪ b ɫ̩
sigmatism	s ɪ ɡ m ʌ t ɪ z m
sixth	s ɪ k s θ
sixth	s ɪ k s t̪
sket	s k ɛ t
sket	s k ɛ ʔ
sketty	ˈs k ɛ t i
sketty	ˈs k ɛ ʔ i
skillful	ˈs k ɪ ɫ f ə ɫ
skweee	s k w iː
slaten	ˈs l e ɪ t n̩
Slovak	ˈs l ɑ v ə k
snail	s n̥ e ɪ̯ ɫ
soil	s ɔ ɪ̯ ɫ̩
something	ˈs ɐ m̥ p θ ɪ ŋ
something	ˈs ʌ m̥ p θ ɪ ŋ
something	ˈs ʌ n̪̥ θ ɪ ŋ
something	ˈs ʌ m ʔ m̩
something	ˈs ʌ ɾ̃ ɪ ŋ
something	s ʌ̃ː
something	s ʌˑ ɪ ŋ
spider	ˈs p ʌ ɪ̯ ɾ ə ɹ
squee	s k w iː
stability	s t ə ˈb ɪ l ɪ ɾ i
staff	s t ɑː f
staff	s t äː f
staff	s t ɐː f
staff	s t æ f
staff	s t ɛ ə f
staff	s t e ə f
staff	s t a f
staff	s t æ f
staff	s t æ f
staff	s t ɛ ə f
staff	s t e ə f
standardise	ˈs t æ n d ə ɹ d a ɪ z
standoff	ˈs t e ə n d ɑ f
startup	ˈs t ɑ ɹ ɾ ˌʌ p
statistically	s t ə ˈt ɪ s t ɪ k l̩ i
status	ˈs t æ ɾ ɪ s
steel	s t iː ɫ
steven	ˈs t iː v n̩
steven	ˈs t e ɪ̯ v n̩
steven	ˈs t ɛ v n̩
still	s t ɪ ɫ
stope	s t o ʊ p
streets	ʃ t͡ʃ ɹ i t͡s
strong	s t̠͡ɹ̠ ɑ ŋ
strong	ʃ t̠͡ɹ̠ ɑ ŋ
styll	s t ɪ ɫ
subhuman	s ʌ b ˈh j uː m ə n
substituent	s ʌ b ˈs t ɪ t ʃ u ə n t
subtle	ˈs ʌ ɾ ɫ̩
sudden	ˈs ʌ d n̩
Sui	s u̯ e ɪ̯
symphony	ˈs ɪ ɱ f ə n i
syntagms	ˈs ɪ n t æ m z
t'	t̚
t'	ʔ
t'	ː
ta	tʰ ɑː
tab	tʰ æ b̥
tackle	ˈtʰ æ k ɫ̩
take	tʰ e ɪ̯ k
Talib	ˈtʰ æ l ɪ b
talked	tʰ ɔː k t
tap	tʰ æ p
teal	t iː ɫ
teared	t ɪː d
teared	t i ɚ̯ d
teared	t ɛː d
teared	t ɛ ɚ̯ d
tech	tʰ ɛ k
tej	ˈt ɛ d͡ʒ
Telangana	ˌt̪ ɛ l ə ŋ ˈɡ ɑː n ə
thickie	ˈθ ɪ k i
thread	θ ɾ̪̊ ɛ d
thrice	θ ɾ̪̊ ɑ ɪ s
thrice	θ ɾ̪̊ ä ɪ s
thrill	θ ɾ̪̊ ɪ ɫ
thrill	θ ɹ̥ ɪ ɫ
thrill	θ ɾ̪̊ ɪ l
thrill	t̪ ɾ̪̊ ɪ l
thrill	θ ɹ̥ ɪ ɫ
tidbit	tʰ ɪ d̚ b ɪ t̚
time	tʰ a ɪ̯ m
tin	tʰ ɪ n
titty	ˈtʰ ɪ ɾ i
titty	ˈtʰ ɪ ɾ i
tomato	tʰ ə̥ ˈm e ɪ ɾ o ʊ
trace	t ʃ ɹ e ɪ s
traditionally	t ɹ ə ˈd ɪ ˌʃ n̩ l i
traditionally	t ɹ ɪ ˈd ɪ ˌʃ n̩ l i
train	t̠ ɹ̠̊ ˔ e̞ ɪ n
trainee	t ʃ ɹ e ɪ ˈn i
trainees	t ʃ ɹ e ɪ n i z
Transcaucasia	ˌt ɹ æ n s k ɔː ˈk e ɪ z j ə
Transcaucasia	ˌt ɹ æ n s k ɔː ˈk e ɪ ʒ ə
trap	t̠ ɹ̠̊ ˔ æ p
trap	t̠ ɹ̠̊ ˔ ä p
trap	t̠ ɹ̠̊ ˔ ɛ p
traumata	ˈt ɹ ɔ m ə ɾ ə
traumata	t ɹ ɔ ˈm ɑ ɾ ə
traumata	t ɹ ɔ ˈm æ ɾ ə
trick	t̠ʰ ɹ̠̊ ɪ k
trick	t ʃ ɹ̠̊ ɪ k
trill	t̠ʰ ɹ̠̊ ɪ l
trim	t̠ʰ ɹ̠̊ ɪ m
trip	t̠ʰ ɹ̠̊ ɪ p
true	t̠ ɹ̠̊ ˔ʷ u̠ː
trust	t ɹ ʌ s t
trust	t ɹ ɐ s t
truthfully	ˈt ɹ uː θ f ɫ̩ i
try	t͡ʃ ɹ a ɪ̯
try	t ɹ̝̊ a ɪ̯
try	t̠͡ɹ̠̊ ˔ a ɪ̯
try	t̠͡ɹ̠̊ ˔ʷ a ɪ̯
tumult	ˈt ʌ m ʌ l t̰̚
tut	ǀ
twain	tʰ w̥ e ɪ n
twice	t w̥ a ɪ s
twill	t w ɪ ɫ
twin	t w̥ ɪ n
twink	tʰ w̥ ɪ ŋ k
twist	t w̥ ɪ s t
twit	tʰ w̥ ɪ t
twitch	tʰ w̥ ɪ t͡ʃ
unilateral	ˌj ʉː n ɪ ˈl æ t ə ɹ ɫ̩
unilateral	ˌj ʉː n ɪ ˈl æ t͡ʃ ɹ ɫ̩
unilateral	ˌj ʉː n ə ˈɫ æ ɾ ɚ ɻ ɫ̩
unintentional	ˌʌ n ɪ n ˈtʰ ɛ n ʃ n̩ ɫ̩
unlicensed	ˌʌ n ˈl a ɪ s n̩ s t
unnerstand	ɜ ɽ̃ ɻ ˌˈs t æ n d̚
vajazzle	v ə ˈd͡ʒ æ z l̩
vale	v e ɪ ɫ
veto	ˈv iː ɾ o ʊ
veto	ˈv iː tʰ o ʊ
virtually	ˈv ɝ t͡ʃ u ə ɫ i
vision	ˈv ɪ ʒ n̩
Vlach	v l ɑː k
Vlach	v l æ k
vouchsafe	ˌv ʌ ʊ t ʃ ˈs e ɪ f
wah	w aːː
wah	w æːː
wail	w e ɪ ɫ
wain	w eː n
waistband	ˈw e ɪ s t ˌb æ n d
waiting	ˈw e ɪ̯ ɾ ɪ ŋ
waiting	ˈw e ɪ̯ ɾ ɪ ŋ
wale	ˈw e ɪ ɫ
water	ˈw ɑ ɾ ɚ
wealth	w ɛ l̪ θ
wean	w eː n
weeaboos	w iː a b yː z
welp	w ɛ l p̚
weren't	w ɝ̃ ʔ t̚
weren't	w ɝ n
weren't	w ɝ̃ ʔ
what	w ʌ ɾ
what	w ʌˀ
what	w ʌ ɾ
what	w ʌˀ
whataboutism	w ə ɾ ə ˈb a ʊ ɾ ɪ z m̩
wheugh	ɸ ɪ̥ u̯ h
whew	ʍ ĭ̥ ŭ̥
whew	ɸ ĭ̥ ŭ̥
whine	ʍ a ɪ̯ n
whine	ʍ ʌ ɪ̯ n
whine	ʍ äː n
whine	ʍ ɑ e̯ n
wholemeal	ˈh ɔ ʊ ɫ m i ə ɫ
wholest	ˈh o ʊ̯ ɫ ɛ s t
width	w ɪ d̪ θ
wild	w a ɪ̯ ɫ d
wild	ˈw a ɪ̯ ɫ̩ d
Wilde	ˈw a ɪ ə̯ ɫ d
will	w ɪ ɫ
winter	ˈw ɪ ɾ̃ ɚ
winter	ˈw ɪ n tʰ ɚ
winter	ˈw ɪ n ɚ
winter	ˈw ɪ n tʰ ɚ
winter	ˈw ɪ n ɚ
winter	ˈw ɪ ɾ̃ ɚ
winter	ˈw ɪ n tʰ ɚ
winter	ˈw ɪ n ɚ
winter	ˈw ɪ n ɚ
wintertide	ˈw ɪ ɾ̃ ɚ t a ɪ d
Wisconsin	w ə ˈs k ɑ n s n̩
Wisconsin	w ə s ˈkʰ ɑ n s n̩
without	w ɪ θ ˈɐ ʊ t
without	w ɪ ð ˈɐ ʊ t
work	w ɜː k
work	w ɜː k
work	w œː k
work	w ɔː k
work	w ɛː k
work	w ʊː ɹ k
work	w ɚ k
worra	ˈw ɒ ɾ ə
wouldn't	ˈw ʊ n ʔ
wrake	ɹ e ɪ̯ kʰ
writer	ˈɹ̠ ʌ ɪ ɾ ɚ
yatt	j æ t
yatt	j a t
yeh	j ɛ
yeh	j ɛː
yeh	j ɛ ə
yep	j ɛ p̚
yive	j ɪ v
yup	j ʌ p̚
Zarina	z ʌ ˈɹʲ i n ə
Zemfira	z ɪ ɱ ˈf i ɹ ə
Zemfira	z ɛ ɱ ˈf i ɹ ə
ziti	ˈz i ɾ i
zun	z ʌ n
מאַמאַליגע	m ɑ m ɑ ˈl i ɡ ɛ
